{
  "id": "S039",
  "date": "2026-09-10",
  "trajectory": "T6",
  "competency_band": "Evaluate",
  "journal": "journal/2026-09-10-S039-delivery.md",
  "objectives": [
    {
      "id": 1,
      "statement": "A review gives three concrete efficiency and prompting examples",
      "result": "met"
    },
    {
      "id": 2,
      "statement": "The next session can resume from current verified context",
      "result": "met"
    },
    {
      "id": 3,
      "statement": "The overhaul is prepared for the authorized PR/rebase/merge flow",
      "result": "met"
    }
  ],
  "artifacts": [
    {
      "path": "Hand_off.md",
      "kind": "doc"
    },
    {
      "path": "docs/reviews/2026-09-10.md",
      "kind": "doc"
    },
    {
      "path": "journal/2026-09-10-S039-delivery.md",
      "kind": "doc"
    }
  ],
  "evidence": [
    {
      "claim": "GitHub access and target repository are verified",
      "method": "gh auth status; gh repo view; gh pr status with host access",
      "result": "authenticated; default branch main; no open PR for this work",
      "verdict": "verified"
    },
    {
      "claim": "Final publication test and reference gates pass",
      "method": "python3.11 -m unittest discover -s tests; python3.11 -m vibecoder.cli verify --seeds 3",
      "result": "1420 tests OK in 59.230s; 54/54 reference runs clean",
      "verdict": "verified"
    },
    {
      "claim": "The PR is merged",
      "method": "GitHub PR state after publication; locate by head feat/terminal-cockpit",
      "result": "publication follows this commit; consult GitHub for the final state",
      "verdict": "unverified"
    }
  ],
  "misconceptions": [],
  "decisions": [],
  "friction": [
    {
      "description": "Restricted GitHub check could not validate login; host-access check succeeded without credential changes",
      "impact": "low",
      "resolved": true
    }
  ],
  "handoff": {
    "state": "Implementation and closeout documents prepared for publication; consult the GitHub PR for final state",
    "next_action": "Human playtest the 80- and 120-column flows, then return to T5 W3",
    "blockers": [],
    "context_required": [
      "Python 3.11",
      "Host sandbox backends for full test discovery",
      "Q100 is not decided by delivery authorization",
      "Temporary PTY smoke driver is not committed"
    ]
  },
  "open_questions": [],
  "metrics": {
    "tests_total": 1420,
    "tests_passing": 1420,
    "dependencies": 0
  }
}
